,kai,house,m_name,gou,date,s0,s1,s2,s3,s4,s5,s6,s7,s8,s9,s10,s11,s12,s13,s14,s15,s16,s17,s18,s19
0,196,衆議院,財務金融委員会,10号,平成30年03月30日,川内委員　川内でございます。よろしくお願いをいたします。まず、麻生大臣に聞かせていただきたいと思います。大臣は、昨日の参議院財政金融委員会で、報道されておるわけでございますけれども、森友の方がＴＰＰ11より重大だと考えているのが日本の新聞のレベルだという趣旨の発言をされたというふうにされております。未定稿ではございますが、議事録を確認いたしますと確かにそのように御発言をされていらっしゃったようでございます。これは、事実とすれば極めて残念な発言であるというふうに私は思っておりまして、森友問題、この文書の改ざんというのは、大臣御自身が、事実とすればゆゆしき事態であるというふうにおっしゃられていた問題であって、今までの財務省の御報告では理財局の一部がという言葉になっているわけですが、本当にそうなのか、誰がいつ、どのような目的でこのようなことをしたのかということについてはまだつまびらかに明らかになっていない状況なわけでありまして、もしかしたら財務省の組織としての問題ではないのか、この公文書の、決裁文書の改ざんあるいは隠蔽というもの、これは、麻生大臣もそうだし、安倍総理大臣も、行政の信頼を揺るがしたというふうにおっしゃっていらっしゃるわけで、重大かつ極めて深刻な問題であるというふうに思います。そういう、森友問題についてＴＰＰ11とお比べになられたということについて、それはちょっと言葉が足りなかったねと反省しているということを朝の会見でおっしゃられたようでありますが、私は、この発言については、そういう釈明ではなく、発言を撤回すべきであるというふうに思いますが、麻生大臣の御認識をいただきたいと思います。,川内委員　最終的な段階って、問題が全部終わっちゃったら終わっちゃうわけで、結局改ざんでしたというのはめっちゃ格好悪いと思うんですよ。改ざん前と改ざん後の資料を見ても、大幅に削除していたり、書き換えたり、意味内容が変わっていたり。これは太田理財局長も、この前、個人的にはという前置詞はつきましたが、この部分は意味内容が変わったかもしれないというようなことを御発言になられていらっしゃったし、安倍総理大臣も、これは改ざんという認識だという御答弁をされていらっしゃる。これは、行政の信頼を取り戻すという意味においては、まず政府として、この問題を行政文書が改ざんされた問題というふうに捉えて、そして、真剣にきちんと調査をし取り組むよということを言わなければ、結局、せんだっての佐川証人の証言も、証言拒否が連発をされて何にもわからない、疑惑だけが国民の中に広がっているという状況で、これは与野党ともに不幸な状況だと思うんです。みんながこれを明らかにして、みんなで政治や行政の信頼を取り戻していこうねというふうにしなければならないわけで、その出発点が、まず当事者がこの問題を重く受けとめているという意思を表明する。それにはやはりタイトル、名前というのは大事ですから、行政文書の改ざんという言葉をきちんと使うべきだ。改ざんという言葉を使ったからって、捜査の対象になるかならないかは、それは捜査機関がいろいろ判断することであって、改ざんという言葉がすなわち即座に犯罪に結びつくわけでもないし、ここはしかし、国民一般が思っている改ざんだ、大変な改ざんが行われたんだということを、政府として意思を表明すべきであるというふうに思います。ぜひ大臣、ここは大臣としての、だって、三月十一日に初めて聞かされて、記者会見で後ろを振り返って、おれが聞いたのはいつだったっけ、ああ、三月十一日かと、そのとき初めて大臣もお知りになられたわけですよね、初めてお知りになられた。そういう一年間大臣にさえ何にも言ってこなかったこの事案に対して、ここは大臣としてリーダーシップを発揮して、改ざんという言葉を使わせる、そしてちゃんと全てを明らかにするということを、意思を表明していただきたいというふうに思います。もう一度お願いします。,川内委員　内閣官房の方にきょう来ていただいておりますので、教えていただきたいんですけれども、最近、もう一度ちゃんと話を聞くべきではないかとされている人物の一人に谷査恵子さんという方がいらっしゃるわけですが、内閣総理大臣夫人付の名刺を持っていた谷査恵子内閣事務官は、安倍昭恵内閣総理大臣夫人の内閣総理大臣の公務の遂行を補助することを支援する職員ということであり、夫人付事務官は首相官邸内に一定の執務スペースを設けていたということでありますが、そのスペース、その執務室とは、総理大臣や総理秘書官と同じ官邸五階に設けられていたということでよろしいでしょうか。,川内委員　総理の部屋と総理秘書官の部屋が五階にある、これは公知の情報ですけれども、セキュリティーというのは、夫人付の執務室、今はもうないんですよ。それがどこにあったんですかと聞くことが官邸のセキュリティーと何がどう関係するのか、さっぱりわからないんですけれども、それさえも言わない。そういうことが、私、国民の皆さんの一体何なのということにつながるんじゃないかと思いますが。安倍昭恵夫人は平成二十六年、二〇一四年の四月二十五日、そして十二月六日、平成二十七年九月五日の三回、森友学園塚本幼稚園で講演されていらっしゃるわけですが、谷査恵子夫人付事務官は一回目と三回目は同行したというふうに聞いております。二回目は同行しなかったと聞いております。一回目、二回目、三回目はそれぞれ夫人付の誰と誰が同行したのかということを教えていただきたいと思います。,宮本（徹）委員　次に行きます。先日の佐川さんの証人喚問、刑事訴追のおそれという理由で証言拒否が連発されるということになりました。結局、なぜ法を犯してまで安倍昭恵さんの名前を削除する必要があったのか、この点については、国民が一番聞きたかったわけですが、語られることはありませんでした。ただ、この証人喚問の中で、私、一つはっきりしたのは、昨年の佐川さんの国会答弁の正当性が揺らいだということだと思うんです。佐川さんは、森友事案の交渉記録について、昨年二月二十四日はこう答弁されていたわけですね。昨年六月の売買契約の締結に至るまでの財務局と学園側との交渉記録につきまして、委員からの御依頼を受けまして確認しましたところ、近畿財務局と森友学園の交渉記録というのはございませんでした。ところが、証人喚問の場では、佐川さんは、この答弁について、本省で文書の取扱規則を確認したということでそういう答弁をした、こうお述べになりました。交渉記録が実際にあるかどうかは確認せずに、実際確認したかのように答弁したということです。麻生大臣、事実を確認せずに事実を確認したかのような答弁をするというのは、これは国会を欺く行為ということだと思いますが、大臣はどうお考えですか。,今井委員　ぜひ、慎重に検討して、これは本当に会計検査院の権威にもかかわりますから、厳しい厳しい態度で臨んでいただきたいと思います。時間が参りましたので終わりますけれども、先日、証人喚問をさせていただきまして、私、佐川さんに、政治家の関与、安倍昭恵さんの関与はなかったんですかと言ったら、なかったと思いますと。なぜですかと言ったら、自分が資料を読んだり勉強したりしたところでそうですと言われたので、当時の関係者に全部ヒアリングしたんですかと言ったら、いや、それはしていませんとおっしゃって、詳しくはそこはわかりませんと。関係者の人に聞かないで、何でこんなことがわかるんだと。あり得ないですよね。いかにいいかげんに、推測でしゃべっているのかということがよくわかりましたけれども。ですから、やはり、これは改ざんの問題もあるんですけれども、一番の問題は、その前の八億円の値引きですから、ここが危険なんですよ。ここからいろいろなことがあって改ざんにも追い込まれたということですから、ここの部分を明らかにしない限りこの森友の問題は終わらないということですので、関係者の話をしっかり聞いていきたいと思いますので、よろしくお願いしたいと思います。終わります。,,,,,,,,,,,,,,
1,196,衆議院,経済産業委員会,3号,平成30年03月30日,斉木委員　日銀の組織目標である物価安定、そしてそれを二％の物価上昇率を達成するまで続けるという御発言がありましたけれども、私は、まさに政治目標に縛られて金融政策がゆがめられていると思います。二〇一三年の一月、アベノミクス、安倍政権が発足をして、日銀と安倍政権共同で宣言を出しましたね。二〇一三年一月、安倍政権として二％の物価目標を達成していくということを政府、日銀一体で掲げられました。要するに、選挙で訴えたこと、そして政権が訴えたことを何とかクリアするために、それを達成するまで無理をしてでも続けているように私には映ってなりません。じゃ、実際、今の世界の物価上昇率はどれぐらいなのか。アメリカは大体今一・四％ぐらいですかね。そして、ＥＵ、これが大体一％台後半ぐらい。日本は一％を達成できるかできないか、そこの境界線をさまよっている。これを二％まで持っていくのは、私は、これは事実上非常にハードルは高い。これ以上ＥＴＦ、今月、最大買いましたね、八千三百億円以上購入されている。それでも日経平均は下がっているし、原油価格が非常に高騰でもしない限り、二％というのは達成できないし、それは日本経済にとって非常にマイナスの局面だろうというふうに思っております。政権、政治目標に、二％に日銀が振り回されているこの現状を私は非常に危うい状況だと思っているんですが、世耕経産大臣はその経済の影響をどのようにお考えですか。,斉木委員　そのためには、私は、二％に達するまでマイナス金利に拘泥するような、目的と手段が逆になっているような政策というのはやはり再考すべき時期ではないかなというふうに思っております。もう一つ、最近の金融政策、そしてマーケットの関係者の発言を聞いておりますと、アベグジットという発言が非常に今出てきております。今、政局として森友学園問題が報じられていて、もう安倍さん、政権はかわるんじゃないか、そうしたらこの金融緩和政策は、黒田日銀体制もやはり政策を変えざるを得ないんではないか、それを投資家が先回りをして、アベグジットを見越しているから、米中に比べてこの二月、三月、大きく下がっているんではないかということが投資家の間で言われております。このアベグジットという投資家の投資姿勢に対して、まず日銀さんはどうお考えですか。,世耕国務大臣　私は全くそういうことは意識をせずに、安倍内閣というのは、仕事をしっかりやって成果を上げる、これは経済でも外交でもそういう姿勢で閣僚として取り組んでいく、それに尽きるんだろうというふうに思っています。,斉木委員　マーケットというのはいろいろな臆測を読み込んで動くものですので、まさに、政局が起きると、アベノミクスというより、もう既にアベグジットを織り込んだ株価に日経平均株価が下がり始めている。だから、やはり、金融緩和で幾ら吹かしても、ＥＰＳであるとか売上げであるとか、これが常に右肩上がりでいく、まさにグーグルやアマゾン、そしてアップル、テンセント、アリババといった企業はそういった企業だろうというふうに投資家がみなしているからこそ、トップフィフティーを占めているし、そして指数も上がっていっている。日本企業はどうなのか。安倍さんがいなくなったら投資する価値がない、だから下がる、これは非常に本質的に危うい状況だと思いますが、その点どうでしょうか、世耕経産大臣。,世耕国務大臣　なかなか答えにくいんですけれども、一方で、やはり安倍政権に対するマーケットの期待が逆に強いということの今の状況はあらわれではないかと。もう一度しっかり体制を立て直して、マーケットにもいい影響が与えられるような政権として、しっかり仕事に頑張ってまいりたいというふうに思います。あと、おっしゃっているように、やはり成長の期待を持たれる企業を一つでも多く生み出していくということが重要だと思います。アマゾンにしても、例えば、ほとんど利益は出ていないわけであります。ただ、そのビジネスモデルがやはり今後マーケットを大きくとっていくだろうという、現にとっている面もあるわけですが、そういった期待感、新しいサービスを生み出していく期待感から株価が高くなっているというのがアメリカの、特にＩＴ企業の特徴だというふうに思います。それが日本人の性格になじむかどうかは別として、やはりそういう期待の持てる企業を一つでも多く生み出すために、これはなかなか政策だけで生み出せるものではありませんけれども、経産省としてもやれることはしっかりやってまいりたいと思います。,菊田委員　しっかり対応していただきたいと思います。次に、森友問題について、財務省により決裁文書の改ざんという決して許されない違法行為が行われ、今週二十七日火曜日には、衆参の予算委員会で佐川前国税庁長官の証人喚問が行われました。しかし、真相の解明には遠く届かず、安倍昭恵夫人、迫田元国税庁長官、谷査恵子元首相夫人付らの、御本人の公の場における説明が必要です。問題となった、改ざんした文書を提出するという行為は、国会に対する冒涜にほかなりません。また、省庁中の省庁とも言われる財務省が文書の改ざんに手を染めたことは、行政に対する信頼を決定的に失墜させました。経産省における決裁文書、国会提出資料は財務省で行われたような改ざんはないと自信を持って言い切れるか、大臣に伺います。野田総務大臣は、総務省内で点検をすると発言し、点検の結果、総務省内では問題がなかったようですが、経産省は調査したのでしょうか。する考えがあるのかないかもあわせてお答えください。,菊田委員　各種世論調査を見ても、麻生財務大臣及び安倍総理大臣の責任を問う国民の声は大多数です。民間企業でこのような事態が生じれば、トップである社長は辞任をし、責任をとるのが常識だと考えますが、財務大臣及び総理大臣の責任について、世耕大臣の見解を伺います。,菊田委員　大臣は今、安倍総理や麻生大臣が、御本人がおっしゃっているとおりと言ったんですけれども、きのうの参議院の財政金融委員会での麻生大臣の発言ですね、全く当事者としての自覚や反省が足りない。本当に私はもうびっくりしました。改めて、お二人の責任、追及をしていかなければならないというふうに思います。次に、ほかの委員からも質問がありましたけれども、トランプ政権が二十三日に鉄鋼、アルミニウム製品への新たな関税を発効したことについて伺います。知的財産についても制裁措置の対象とされた中国が報復関税で対抗するなど、貿易戦争とも言える状況が生じているのではないかと大変危惧されるわけであります。まず、トランプ政権が新たな関税を発効する原因となった鉄鋼及びアルミニウムについて、世界の供給体制が現在どのような状況にあるのか、また、その現状認識はトランプ政権と共有しているものなのか、大臣、お答えください。,笠井委員　日本共産党の笠井亮です。今、国民の怒りが沸騰している森友公文書の改ざん事件は、国民主権と議会制民主主義の根本にかかわる重大問題であります。当委員会でも世耕大臣の所信表明では当然、ぜひこの問題に言及すべきであると私が理事懇談会で求めたところ、自民党の吉川筆頭理事からは、御心配なきようという話がございました。ところが、実際には一言も言及されませんでした。なぜかという問題であります。今、菊田議員の質問に対して書換え問題ということを繰り返し言われましたが、一昨日は、落合議員の質問には、決裁文書の改ざんは国民の信頼を大きく傷つけたと、改ざんとはっきり言ったのに、今度は書換えとなっちゃっているので、ちょっとまたそういう問題があるのかと思いますが、改めて伺いますが、安倍内閣の閣僚の一員として、この公文書改ざん問題をどう受けとめていらっしゃいますか。,笠井委員　当たり前と思っていたことが、そうじゃなくて、財務省で現に起こってこんな大問題になっている、そして日本の政治を揺るがしているという問題であります。では伺いますけれども、安倍政権は、二〇一六年の十二月二十一日に、高速増殖炉「もんじゅ」を廃炉にして、そして、新たな高速炉開発の方針を決定しました。東京電力の福島第一原発事故の収束もできないまま、「もんじゅ」の破綻にも懲りずに、核燃サイクルに固執をして新たな原発開発に突き進むという、ある意味重大な政策転換でありますが、この方針を決める過程で高速炉開発会議という会議が行われましたが、世耕大臣、議長を務められたと。何回、合計何時間何分、この会議は開かれたんでしょうか。,笠井委員　結局、大臣は、個社の問題だ、外交上のやりとりだと言われながら、一切明らかにしない。そして、決まったらいずれ歴史には残るように公文書館にみたいな話になりますが、結局、決まった時点ではもうツケは国民に回ることになっちゃっていたら大変なことになるわけですよ。どうやって責任をとるのか。ただ歴史に残せばいいという話じゃないでしょう。やっちゃいけないことは絶対にやめなきゃいけない、やっちゃいけないんですよという問題ではないかと思います。日立の中西会長は、政府保証が必要なほど高リスクの事業を進めるべきかという記者会見での、先ほどの記者会見ですが、質問に対して、投資可能だと説明することが難しくなったのは事実と述べて、純粋な民間事業として推進するのは困難だと認めました。その上で、投資家に保証として日本政府が保険も考えようと言っている段階だ、しっかり物をつくって不信感をはね返す、こう答えているわけですね。一方、事業を進める主体である日立は、そうやってどんどんどんどん具体的に日本政府に要請していますよ、支援もと。そして、今、日本政府はこうやって保険も考えると言っていますよと。片っ方では個社の問題と言いながら、個社の方はどんどんどんどん世間に向かって公表しているわけですよね。投資家に向かっても説明しているわけですよね。政府が黙り続けるというのは余りにおかしいんじゃないですか。それだけじゃありません。大体、この日立と経産省との本当に濃密な関係というのは、私も先日も指摘をさせていただきました。次期日本経団連会長でもある中西日立会長は、安倍首相が議長を務める未来投資会議のメンバーで、その中でインフラ輸出、原発の問題も議論になっている。そして、現在、日立の社員が経産省通商金融課に出向していて、日立の経営陣には、元経産省の事務次官、資源エネルギー庁の長官を歴任して、メーカーと一体に原発輸出を推進してきた望月晴文社外取締役がおります。このことを予算委員会で明らかにしましたが、それだけじゃなかったんですね。質問直前のことし一月末ですが、日立の執行役常務に伊藤仁元特許庁長官が就任をして、渉外担当と東原社長付ということになっております。資源エネルギー庁で総合政策課長も経験した専門家でありますけれども、こうやって全部固めて一体になって原発推進、輸出推進をやっている、これが実態じゃないですか。世耕大臣は、個人の就職先については関与しないと先日も答弁されましたけれども、ここまで濃い日立との関係について、一体どう国民に説明責任を果たすんですか。,,,,,,,,,
